"title","description","budget_min","budget_max","currency","skills_required","client_rating","client_reviews","posted_date","project_type","experience_level","duration","url","platform","is_remote","search_type"
"MERN Stack Developer for E-commerce Platform","Need a skilled MERN stack developer to build a modern e-commerce platform with React frontend, Node.js backend, and MongoDB database.",2000.0,5000.0,"USD","React, Node.js, MongoDB, Express, JavaScript",4.8,45,"2025-07-12","Fixed Price","Intermediate","2-3 months","https://www.upwork.com/jobs/~5249944435487756868","Upwork",True,"Freelance Gig"
"React Developer with Node.js Backend Experience","Looking for a React developer who can also handle Node.js backend development. Project involves building a real-time chat application.",1500.0,3000.0,"USD","React, Node.js, Socket.io, MongoDB",4.6,23,"2025-07-12","Fixed Price","Entry","1-2 months","https://www.upwork.com/jobs/~-3369897033492241140","Upwork",True,"Freelance Gig"
"Build Complete MERN Stack Web Application","I will develop a complete MERN stack web application with React frontend, Node.js backend, and MongoDB database. Includes authentication, API development, and deployment.",500.0,2000.0,"USD","React, Node.js, MongoDB, Express, JavaScript, REST API",5.0,127,"2025-07-12","Fixed Price","Expert","5-10 days","https://www.fiverr.com/services/9046112524051356352","Fiverr",True,"Freelance Gig"
"React Frontend Development with Node.js Backend","Professional React frontend development with Node.js backend integration. Clean code, responsive design, and modern UI/UX.",200.0,800.0,"USD","React, Node.js, JavaScript, CSS, HTML",4.9,89,"2025-07-12","Fixed Price","Intermediate","3-7 days","https://www.fiverr.com/services/7294236402676843286","Fiverr",True,"Freelance Gig"
"MERN Stack Developer Needed for Startup","Startup looking for experienced MERN stack developer to build MVP. Must have experience with React, Node.js, MongoDB, and deployment.",3000.0,8000.0,"USD","React, Node.js, MongoDB, Express, AWS, Docker",4.7,34,"2025-07-12","Fixed Price","Expert","3-6 months","https://www.freelancer.com/projects/9154797485212464414","Freelancer.com",True,"Freelance Gig"
"React Developer for E-commerce Website","Need a React developer to build an e-commerce website with Node.js backend. Should include payment integration and admin panel.",1000.0,2500.0,"USD","React, Node.js, Stripe, MongoDB, E-commerce",4.5,18,"2025-07-12","Fixed Price","Intermediate","1-2 months","https://www.freelancer.com/projects/-1122370027404539499","Freelancer.com",True,"Freelance Gig"
